{
  "$schema": "https://json-schema.org/draft/2020-12/schema",
  "title": "ticket",
  "description": "The frontmatter of tickets/NN-slug.md (BRIEF 8.2, Implementation Decisions 2), plus pinned_difficulty and retry.",
  "type": "object",
  "required": ["id", "title", "kind", "difficulty", "status", "blocked_by", "touches", "role", "acceptance", "proposed_by"],
  "additionalProperties": false,
  "properties": {
    "id": {"type": "integer", "minimum": 1},
    "title": {"type": "string", "pattern": "\\S"},
    "kind": {"$ref": "#/$defs/kind"},
    "difficulty": {"$ref": "#/$defs/difficulty"},
    "status": {"type": "string", "enum": ["open", "running", "done", "accepted", "failed", "blocked", "needs_human", "parked"]},
    "blocked_by": {"type": "array", "items": {"type": "integer", "minimum": 1}},
    "blocking": {"enum": ["subgraph", "all", null], "description": "decision tickets only"},
    "human_only": {"type": "boolean", "description": "decision tickets only"},
    "touches": {"type": "array", "items": {"type": "string", "pattern": "\\S"}, "description": "the touch set: paths the ticket may write, enforced by the hook"},
    "resources": {
      "type": ["object", "null"],
      "additionalProperties": false,
      "properties": {
        "gpu": {"type": "integer", "minimum": 0},
        "cpu": {"type": "integer", "minimum": 1},
        "ram_gb": {"type": "number", "minimum": 0},
        "wallclock_minutes": {"type": "integer", "minimum": 1}
      }
    },
    "role": {"type": "string", "pattern": "^[a-z][a-z0-9-]*$"},
    "skills": {"type": "array", "items": {"type": "string", "pattern": "^[a-z0-9][a-z0-9-]*$"}},
    "software": {"type": "array", "items": {"type": "string", "pattern": "^[a-z][a-z0-9-]*$"}, "description": "the tools the ticket needs, by their names in tools.json (octave, r, julia, matlab, or a harness tool); it is not launchable until every one is recorded or its software decision said Go without (decision 17; ticket 82)"},
    "inputs": {"type": "array", "items": {"type": "string"}},
    "outputs": {"type": "array", "items": {"type": "string"}},
    "acceptance": {
      "type": "object",
      "additionalProperties": false,
      "properties": {
        "machine": {"type": "array", "items": {"type": "string", "pattern": "\\S"}, "description": "Type-A gates: shell commands that must exit 0"},
        "quality": {"type": "array", "items": {"type": "string", "pattern": "\\S"}, "description": "Type-B gates: questions the verifier answers"}
      }
    },
    "goal_metric": {
      "type": ["object", "null"],
      "required": ["reports", "expected_direction"],
      "additionalProperties": false,
      "properties": {
        "reports": {"type": "string"},
        "expected_direction": {"type": "string", "enum": ["up", "down"]}
      }
    },
    "budget": {
      "type": ["object", "null"],
      "additionalProperties": false,
      "properties": {
        "max_turns": {"type": "integer", "minimum": 1},
        "max_minutes": {"type": "integer", "minimum": 1}
      }
    },
    "context_pack": {"type": "array", "items": {"type": "string"}},
    "origin": {"type": ["string", "null"]},
    "proposed_by": {"type": "string", "pattern": "^(planner|worker:[0-9]+|decider|human|evolve|verifier|tick|conductor|figure)$", "description": "BRIEF 8.2's five authors, plus the figure role, which opens the human-only decision tickets of a figure pick and a refusal and proposes the tickets its findings for the text earn (ticket 50); the verifier: a failing kill argument files the writing ticket that scopes the claims down (Implementation Decisions 11), and no one else wrote it; the tick, which opens the human-only decision ticket when the login nears its end (Implementation Decisions 7); and the conductor, which opens the ask of Implementation Decision 15 while Fable's weekly window is spent"},
    "demo": {"type": ["string", "null"]},
    "pinned_difficulty": {"oneOf": [{"$ref": "#/$defs/difficulty"}, {"type": "null"}], "description": "set by the human; escalation never changes it"},
    "retry": {
      "type": ["object", "null"],
      "description": "experiment tickets only: the footprint ladders of Implementation Decisions 6",
      "additionalProperties": false,
      "properties": {
        "host_oom": {"type": "array", "items": {"type": ["object", "string"], "description": "an override object, or in a ticket file (scalar lists only) the same step spelled \"--batch-size=16 NAME=value\""}},
        "gpu_oom": {"type": "array", "items": {"type": ["object", "string"], "description": "an override object, or in a ticket file (scalar lists only) the same step spelled \"--batch-size=16 NAME=value\""}}
      }
    }
  },
  "$defs": {
    "kind": {"type": "string", "enum": ["dossier", "lit", "code", "docs", "experiment", "analysis", "figure", "writing", "review", "decision", "harness"]},
    "difficulty": {"type": "integer", "minimum": 1, "maximum": 5}
  }
}
